{"aggregation_method_ref":{"artifact_id":"fixture-aggregation-method","artifact_path":"contracts/fixtures/governance-models/support/fixture-aggregation-method.json","artifact_sha256":"7014211037746beacb1b22bf5bf5284ad73e6324224b6d0ec02656084f3d0117","revision":1,"schema":"ylx.synthetic-artifact.v1"},"applicable_requirement_ids":["M0-MEAS-05","M0-MEAS-06","M0-MEAS-07","M0-MEAS-08","M4-CANDIDATE-ASSEMBLY-01","SAFE-SWAP-INTEGRATED-01","RUNTIME-SERVICE-01","CONSUMER-ATTESTATION-01","PREVIEW-CONTENT-01","PREVIEW-RATE-01","PREVIEW-RES-01","PREVIEW-LAT-01","PREVIEW-DROP-01","PREVIEW-DROP-02","PREVIEW-ISOLATE-01","PREVIEW-FALLBACK-01","WEB-JOURNEY-01","WEB-IDEMP-01","WEB-AUTHORITY-01","WEB-VERDICT-01","WEB-SAFE-SWAP-01","WEB-MULTI-01","WEB-SSE-01","WEB-BROWSER-01","NET-AP-01","NET-CLIENT-01","NET-WIRED-01","NET-DUALWIFI-01","NET-MDNS-01","NET-PROVISION-01","NET-PROVISION-02","NET-PROVISION-03","NET-RESCUE-01","CAL-SCHEMA-01","CAL-UNKNOWN-01","CAL-ORACLE-01","CAL-INTEGRITY-01","CAL-STATE-01","CAL-E2E-01","CAL-OLD-01","XFER-MUTEX-01","XFER-LAN-01","XFER-LAN-02","XFER-PROTO-01","XFER-MEDIA-01","XFER-MEDIA-SAFETY-01","XFER-SCRIPT-01","XFER-EQUIV-01","XFER-ENC-RECOVER-01","XFER-OUTPUT-01","XFER-RESOURCE-01","XFER-LOCAL-01","STORE-MINIO-01","STORE-PROD-01","STORE-AMBIG-01","STORE-DELETE-01","SEC-PROFILE-01","SEC-LAB-01","SEC-CUSTOMER-01","SEC-PATH-01","SEC-TLS-01","SEC-SECRET-01","SEC-UNSIGNED-01","ROLLBACK-NET-01","ROLLBACK-WEB-01","ROLLBACK-PREVIEW-01","ROLLBACK-TRANSFER-01","M4A-ISSUES-01","M4B-ISSUES-01","M4C-ISSUES-01","M4D-ISSUES-01","M4-ISSUES-01"],"applicable_support_cell_ids":["fixture-support-cell"],"artifact_metadata":{"classification":"SYNTHETIC_FIXTURE","evidence_claim":"NOT_EVIDENCE_OR_PASS","fixture_notice":"SYNTHETIC EXAMPLE ONLY; NOT EVIDENCE; NOT A PASS VERDICT"},"binding_context_ref":{"artifact_id":"fixture-binding-context-m2","artifact_path":"contracts/fixtures/governance-models/valid/binding-context-m2.json","artifact_sha256":"26813e00e1d8365c946cac14fbacb5ff19d607ca1c6900f32dd42c6322eb6c91","revision":1,"schema":"ylx.binding-context.v1"},"candidate_id":"fixture-target-candidate-001","contract_release_sha256":"ffeaf17fa88b81525de8bbffbfeaaff15900ea3661742d9b2eec086ef2f12300","data_partition_execution_context_refs":[{"artifact_path":"contracts/fixtures/governance-models/valid/execution-context.json","artifact_sha256":"ea9e327bcd84f8a20f333013e3eec83c4b02859e029e3264b35f0a310db00061","context_id":"fixture-execution-context-source"}],"data_partition_ref":{"artifact_path":"contracts/fixtures/governance-models/valid/data-partition.json","artifact_sha256":"5bfdb7fa2ac9256ffaddb79c547ff0f344125c9bf1c449b86c4bb68819fa9508","partition_id":"fixture-partition-source"},"exclusion_rules":[],"frozen_at":"2026-06-01T12:00:00Z","oracle":{"estimator_ref":{"artifact_id":"fixture-estimator","artifact_path":"contracts/fixtures/governance-models/support/fixture-estimator.json","artifact_sha256":"87b9a9a01efaf163264a6ad1062b8c6aef392f1bbe1fc8484b493b9bc0d27e34","revision":1,"schema":"ylx.synthetic-artifact.v1"},"evaluation_protocol_ref":{"artifact_id":"fixture-evaluation-protocol","artifact_path":"contracts/fixtures/governance-models/support/fixture-evaluation-protocol.json","artifact_sha256":"6e6db0615a8bd67c103581c501a225f60456af8bdf8f264f78ee8f5db4eef4d1","revision":1,"schema":"ylx.synthetic-artifact.v1"},"holdout_policy":"validation-only-no-retuning","metric_ids":["fixture-latency-ms"],"oracle_domain":"latency"},"oracle_type":"fitted","owner_role":"qa-evidence-owner","plan_id":"fixture-qualification-plan","predecessor_plan_sha256":null,"product_contract_sha256":"fac531853410276fe9ebca29c631a9215222a84642df67e21ec70d2ca820ae11","qualification_governance_contract_sha256":"6c7c2518f163fa3883c22d2bb77fc57d4d10799b5cd1e50862eaf2e11da5a39e","qualification_revision":1,"repetitions":3,"reviewer_role":"contract-owner","schema":"ylx.qualification-plan.v1","statistical_method_ref":{"artifact_id":"fixture-statistical-method","artifact_path":"contracts/fixtures/governance-models/support/fixture-statistical-method.json","artifact_sha256":"cb0292e8490e5c8071f9b00b4c786389edf902b00afdb52f658c674ecbadc90d","revision":1,"schema":"ylx.synthetic-artifact.v1"},"stimulus":{"input_refs":[{"artifact_id":"fixture-input-","artifact_path":"contracts/fixtures/governance-models/support/fixture-input-.json","artifact_sha256":"f7897265dd4aefc8adec2553efc35036727119120666753a1fbeb476960a6e73","revision":1,"schema":"ylx.synthetic-artifact.v1"}],"protocol_ref":{"artifact_id":"fixture-procedure","artifact_path":"contracts/fixtures/governance-models/support/fixture-procedure.json","artifact_sha256":"c11e9c7ac83900e101c337d321f1050d8cd93c3e6de332da828eb2a3b7ba424d","revision":1,"schema":"ylx.synthetic-artifact.v1"},"stimulus_id":"fixture-stimulus-"},"threshold_refs":[{"artifact_ref":{"artifact_id":"fixture-threshold","artifact_path":"contracts/fixtures/governance-models/support/fixture-threshold.json","artifact_sha256":"352c83240dbf51a9426fec27f89a15e72d1e674f9288a3802865539f0f8a24a2","revision":1,"schema":"ylx.synthetic-artifact.v1"},"threshold_id":"fixture-threshold","threshold_kind":"data-fitted"}]}